
	{
		"Title": "",
		"socialMedia": "",
		"Subject": "",
		"subjectScheme": "",
		"Rights": "",
		"rightsURI": "",
		"rightsIdentifier": "",
		"Image": "",
		"generalModality": "Other",
		"generalModalityOther": "",
		"Technique": "Other",
		"techniqueOther": "",
		"Abstract": "",
		"Methods": "",
		"technicalInfo": ""
	}
